{"base_args": {"logprobs": 20, "max_tokens": 1200}, "extend_args": {"temperature": 1, "n": 30, "max_tokens": 512}, "ans_args": {}, "tok_depth": 1200, "p_thresh": 0.05, "row": {"question": "When did Mohenjo-daro develop into a complex urban center?", "subject": "prehistory", "choices": ["during the Early Shang Dynasty, from 1,000 to 400 B.P.", "during the Qin Dynasty, from 3,500 to 3,000 B.P.", "during the Mature Harappan period, from 4,500 to 4,000 B.P.", "during the Early Harappan period, from 8,500 to 6,000 B.P."], "answer": 2, "input_formatted": "The following are multiple choice questions (with answers) about prehistory.\n\nThe great Mayan king Pacal built temples in the city of Palenque in order to:\nA. satisfy the powerful Mayan astronomer priests.\nB. display his generosity to the common people, since they were allowed to live in the temples.\nC. frighten away enemies, in particular the Spaniards.\nD. legitimize his kingship, since his father was not royal.\nAnswer: D\n\nAccording to Timothy Pauketat, the evidence for social stratification and political power at Cahokia suggests:\nA. a center of Mississippian civilization with conditions similar to the rise of early states.\nB. the limitations of authority in a Native American society of egalitarian foragers.\nC. a simple chiefdom or perhaps a complex chiefdom had evolved by A.D. 1500.\nD. a center of Mississippian civilization with conditions similar to societies on the Northwest Coast of North America.\nAnswer: A\n\nResearchers now believe that the decline of the Maya was caused chiefly by:\nA. a cataclysm of some kind, such as an earthquake, volcano, or tsunami.\nB. ecological degradation resulting from slash-and-burn farming techniques.\nC. endless wars between neighboring Mayan city-states.\nD. practices of interbreeding that led to a steep rise in congenital disorders.\nAnswer: B\n\nRecent research on hominid species dating from the Middle Pliocene indicates there was (as of 2020):\nA. a great amount of species diversity, or a single species that exhibited a lot of diversity.\nB. very little species diversity during this period and very few hominids.\nC. decreased species diversity due to a prolonged ice age followed by a severe drought.\nD. decreased species diversity but increased numbers of hammerstones and flakes, indicating stone tool manufacture.\nAnswer: A\n\nWhat is the approximate mean cranial capacity of Homo erectus?\nA. under 650 cc\nB. about 800 cc\nC. just under 1000 cc\nD. 1200 cc\nAnswer: C\n\nWhen did Mohenjo-daro develop into a complex urban center?\nA. during the Early Shang Dynasty, from 1,000 to 400 B.P.\nB. during the Qin Dynasty, from 3,500 to 3,000 B.P.\nC. during the Mature Harappan period, from 4,500 to 4,000 B.P.\nD. during the Early Harappan period, from 8,500 to 6,000 B.P.\nAnswer:", "index": 86}}